### ISSUE TITLE
Configure tftp server smee to allow idrac8 cross subnet connects

### ISSUE THREAD

**Issue by vladislavPV** [tinkerbell/tinkerbell#728]
Hello ,
tinkerbell version v0.22.0
192.168.1.2 - tinkerbell vip

**Setup:**

We've built 2 subnets for tinkerbell + capi testing, mgm and test.
mgm k8s cluster was provisioned in mgm subnet using capi and tinkerbell on idrac8 nodes, no issues.
Next we've tried to deploy cluster in test subnet and it was not working as expected.

**Simptoms:**

For some reasons PXE was failing to download ipxe.efi file on first try and was switching to boot from drive.

```bash
Enumerating Boot options...
Enumerating Boot options... Done
Lifecycle Controller: Collecting System Inventory...
Lifecycle Controller: Done
Booting...
Booting from PXE Device 1: Embedded NIC 1 Port 1 Partition 1

>>Start PXE over IPv4.
  Station IP address is 192.168.2.36

  Server IP address is 192.168.1.2
  NBP filename is ipxe.efi
  NBP filesize is 0 Bytes
  PXE-E18: Server response timeout.
Boot Failed: PXE Device 1: Embedded NIC 1 Port 1 Partition 1
```

cpdump on tinkerbell ip

```bash
3:00:27.256435 ARP, Request who-has 192.168.1.2 (ff:ff:ff:ff:ff:ff) tell 192.168.1.2, length 28
13:00:34.363521 IP 192.168.2.60.67 > 192.168.1.2.67: BOOTP/DHCP, Request from 18:33:da:81:cd:2d, length 347
13:00:34.364649 IP 192.168.1.2.67 > 192.168.2.60.67: BOOTP/DHCP, Reply, length 349
13:00:38.341346 IP 192.168.2.60.67 > 192.168.1.2.67: BOOTP/DHCP, Request from 18:33:da:81:cd:2d, length 359
13:00:38.342510 IP 192.168.1.2.67 > 192.168.2.60.67: BOOTP/DHCP, Reply, length 349
13:00:38.354825 IP 192.168.2.37.1570 > 192.168.1.2.69: TFTP, length 38, RRQ "ipxe.efi" octet tsize 0 blksize 1468
13:00:38.355440 IP 192.168.1.2.69 > 192.168.2.37.1570: TFTP, length 29, OACK tsize 1061376 blksize 1452
13:00:42.337584 IP 192.168.2.37.1570 > 192.168.1.2.69: TFTP, length 38, RRQ "ipxe.efi" octet tsize 0 blksize 1468
13:00:46.337980 IP 192.168.2.37.1570 > 192.168.1.2.69: TFTP, length 38, RRQ "ipxe.efi" octet tsize 0 blksize 1468
13:00:50.337348 IP 192.168.2.37.1570 > 192.168.1.2.69: TFTP, length 38, RRQ "ipxe.efi" octet tsize 0 blksize 1468
13:00:54.337733 IP 192.168.2.37.1570 > 192.168.1.2.69: TFTP, length 38, RRQ "ipxe.efi" octet tsize 0 blksize 1468
13:00:57.303483 ARP, Request who-has 192.168.1.2 (ff:ff:ff:ff:ff:ff) tell 192.168.1.2, length 28
13:00:58.337094 IP 192.168.2.37.1570 > 192.168.1.2.69: TFTP, length 38, RRQ "ipxe.efi" octet tsize 0 blksize 1468
13:01:09.038519 IP 192.168.1.2.69 > 192.168.2.37.1570: TFTP, length 29, OACK tsize 1061376 blksize 1452
```

Notice that tinkerbell offers blksize 1452 even with configured tftpBlockSize: 1468 (default 512).
We suspect that this missmatch makes idrac just silently drop it and continue to send RRQ which are disregarded by tinkerbell which waits reply on first one.
The fix was to lower tftpTimeout from default 10s to 2s which allowed idrack to retry faster.
Hope this helps someone!

tcpdump of fixed state

```bash
12:35:08.375034 ARP, Request who-has 192.168.1.2 (ff:ff:ff:ff:ff:ff) tell 192.168.1.2, length 28
12:35:38.395997 ARP, Reply 192.168.1.2 is-at 18:11:da:a4:11:8a, length 28
12:35:39.671690 IP 192.168.2.61.67 > 192.168.1.2.67: BOOTP/DHCP, Request from 18:33:da:81:cd:2d, length 347
12:35:39.672285 IP 192.168.1.2.67 > 192.168.2.61.67: BOOTP/DHCP, Reply, length 349
12:35:43.648808 IP 192.168.2.61.67 > 192.168.1.2.67: BOOTP/DHCP, Request from 18:33:da:81:cd:2d, length 359
12:35:43.649618 IP 192.168.1.2.67 > 192.168.2.61.67: BOOTP/DHCP, Reply, length 349
12:35:43.661207 IP 192.168.2.37.1835 > 192.168.1.2.69: TFTP, length 38, RRQ "ipxe.efi" octet tsize 0 blksize 1468
12:35:43.661546 IP 192.168.1.2.69 > 192.168.2.37.1835: TFTP, length 29, OACK tsize 1061376 blksize 1452
12:35:46.148465 IP 192.168.1.2.69 > 192.168.2.37.1835: TFTP, length 29, OACK tsize 1061376 blksize 1452
12:35:46.148625 IP 192.168.2.37.1835 > 192.168.1.2.69: TFTP, length 30, ERROR tftp-err-#8 " "User aborted the transfer"
12:35:46.148845 IP 192.168.1.2.69 > 192.168.2.37.1835: TFTP, length 63, ERROR ENOTFOUND "sending block 0: code=8, error: User aborted the transfer"
12:35:46.171830 IP 192.168.2.37.1836 > 192.168.1.2.69: TFTP, length 30, RRQ "ipxe.efi" octet blksize 1468
12:35:46.172285 IP 192.168.1.2.69 > 192.168.2.37.1836: TFTP, length 15, OACK blksize 1452
12:35:46.172434 IP 192.168.2.37.1836 > 192.168.1.2.69: TFTP, length 4, ACK block 0
12:35:46.172566 IP 192.168.1.2.69 > 192.168.2.37.1836: TFTP, length 1456, DATA block 1
12:35:46.172710 IP 192.168.2.37.1836 > 192.168.1.2.69: TFTP, length 4, ACK block 1
```
